{
  "schema_version": "2.0",
  "benchmark_version": "1.3",
  "benchmark_type": "cloud",
  "created_date": "2025-12-18",
  "client": "BFAI",
  "source_run": "R001",
  "source_file": "results_p25_cloud.json",
  "environment": {
    "type": "cloud",
    "endpoint": "https://bfai-api-ppfq5ahfsq-ue.a.run.app",
    "model": "gemini-3-flash-preview",
    "reasoning_effort": "low"
  },
  "index": {
    "job_id": "bfai__eval66a_g1_1536_tt",
    "embedding_model": "gemini-embedding-001",
    "embedding_dimension": 1536
  },
  "corpus": {
    "file": "QA_BFAI_gold_v1-0__q458.json",
    "question_count": 458,
    "distribution": {
      "single_hop": 222,
      "multi_hop": 236,
      "easy": 161,
      "medium": 161,
      "hard": 136
    }
  },
  "config": {
    "model": "gemini-3-flash-preview",
    "reasoning_effort": "low",
    "temperature": 0.0,
    "recall_top_k": 100,
    "precision_top_n": 25,
    "hybrid_search": true,
    "reranking": true,
    "rrf_alpha": 0.5
  },
  "metrics": {
    "pass_rate": 0.925764192139738,
    "partial_rate": 0.06550218340611354,
    "fail_rate": 0.008733624454148471,
    "acceptable_rate": 0.9912663755458515,
    "recall_at_100": 0.9912663755458515,
    "mrr": 0.740727681696243,
    "overall_score_avg": 4.819213973799126,
    "scores": {
      "correctness_avg": 4.790393013100437,
      "completeness_avg": 4.884279475982533,
      "faithfulness_avg": 4.919213973799127,
      "relevance_avg": 4.9847161572052405,
      "clarity_avg": 4.997816593886463
    }
  },
  "latency": {
    "total_avg_s": 9.4,
    "client_experience_s": 8.14,
    "judge_avg_s": 1.25,
    "by_phase": {
      "cloud_retrieve_avg_s": 0.27,
      "cloud_query_avg_s": 7.87,
      "judge_avg_s": 1.25
    }
  },
  "tokens": {
    "prompt_total": 4930527,
    "completion_total": 191906,
    "thinking_total": 231329,
    "cached_total": 0,
    "total": 5353762,
    "per_question": {
      "prompt_avg": 10765,
      "completion_avg": 419,
      "thinking_avg": 505
    },
    "note": "Token counts estimated from local baseline (same model/prompts)"
  },
  "cost": {
    "input_usd": 0.3698,
    "output_usd": 0.0576,
    "thinking_usd": 0.0694,
    "total_usd": 0.4968,
    "per_question_usd": 0.001085,
    "per_1k_questions_usd": 1.08,
    "pricing": "Gemini 3 Flash: $0.075/1M input, $0.30/1M output, $0.30/1M thinking"
  },
  "breakdown_by_type": {
    "single_hop": {
      "total": 222,
      "pass": 209,
      "partial": 9,
      "fail": 4,
      "pass_rate": 0.9414414414414415
    },
    "multi_hop": {
      "total": 236,
      "pass": 215,
      "partial": 21,
      "fail": 0,
      "pass_rate": 0.9110169491525424
    }
  },
  "breakdown_by_difficulty": {
    "easy": {
      "total": 161,
      "pass": 144,
      "partial": 14,
      "fail": 3,
      "pass_rate": 0.8944099378881988
    },
    "medium": {
      "total": 161,
      "pass": 153,
      "partial": 8,
      "fail": 0,
      "pass_rate": 0.9503105590062112
    },
    "hard": {
      "total": 136,
      "pass": 127,
      "partial": 8,
      "fail": 1,
      "pass_rate": 0.9338235294117647
    }
  },
  "failures": [
    {
      "question_id": "sh_easy_021",
      "question_type": "single_hop",
      "difficulty": "easy",
      "overall_score": 3
    },
    {
      "question_id": "sh_easy_066",
      "question_type": "single_hop",
      "difficulty": "easy",
      "overall_score": 2
    },
    {
      "question_id": "sh_hard_020",
      "question_type": "single_hop",
      "difficulty": "hard",
      "overall_score": 2
    },
    {
      "question_id": "sh_easy_079",
      "question_type": "single_hop",
      "difficulty": "easy",
      "overall_score": 2
    }
  ],
  "execution": {
    "run_timestamp": "2025-12-18T21:02:03.043618",
    "run_duration_seconds": 866.0816550254822,
    "questions_per_second": 0.5288184980508848,
    "workers": 5
  },
  "notes": "First cloud benchmark. Gemini 3 Flash Preview with low reasoning. Matches local baseline v2 configuration for apples-to-apples comparison. Cloud Run is 10% faster on client-facing latency."
}